{
  "schema": "agentguard-provenance-graph/1.0",
  "scan": {
    "scan_id": "83a4b38a-6209-472a-b9a5-7ff4d54525b0",
    "repository": "/mnt/data/AgentGuard-Core-CLI-CICD-v0.4.0-src/AgentGuard-Core-CLI-CICD-v0.4.0/examples/multi_agent_demo",
    "git_commit": "",
    "git_branch": ""
  },
  "summary": {
    "nodes": 37,
    "edges": 41,
    "attack_paths": 10,
    "asset_types": {
      "tool": 2,
      "model": 1,
      "agent": 1,
      "mcp_server": 1,
      "capability": 1,
      "skill": 1,
      "dependency": 4
    },
    "relationship_types": {
      "DEFINES": 11,
      "USES_TOOL": 2,
      "USES_MODEL": 1,
      "HAS_CAPABILITY": 1,
      "USES_SKILL": 1,
      "HAS_FINDING": 10,
      "EVIDENCE_FLOW": 5,
      "HAS_EVIDENCE": 10
    }
  },
  "nodes": [
    {
      "id": "REPO-F8A654DA554BE280B2C7",
      "kind": "repository",
      "subtype": "repository",
      "label": "/mnt/data/AgentGuard-Core-CLI-CICD-v0.4.0-src/AgentGuard-Core-CLI-CICD-v0.4.0/examples/multi_agent_demo",
      "version": {
        "value": "workspace",
        "scheme": "workspace",
        "source": "git"
      },
      "source": {},
      "risk": {
        "finding_count": 10
      },
      "attributes": {
        "branch": "",
        "remote": ""
      }
    },
    {
      "id": "TOOL-36600f572e380b11",
      "kind": "asset",
      "subtype": "tool",
      "category": "tooling",
      "label": "lookup_customer",
      "qualified_name": "app.lookup_customer",
      "framework": {
        "name": "langchain",
        "version": "==0.3.27"
      },
      "version": {
        "id": "AGV-1B728572CEEECFB7E5E2",
        "value": "1.4.2",
        "scheme": "declared",
        "source": "project_manifest",
        "evidence": {
          "project_version": "1.4.2"
        }
      },
      "package": {
        "name": "langchain",
        "version": "==0.3.27"
      },
      "content_digest": "sha256:241108f45b0164046bb141c07213eb31f1a6bbf26e4fff31b169b526f0f86736",
      "source": {
        "file": "app.py",
        "line": 8
      },
      "risk": {
        "finding_count": 2,
        "max_severity": "High",
        "finding_ids": [
          "AGF-0BC167135168B759E2812497",
          "AGF-B55217A8EB201B74309BDE85"
        ]
      },
      "attributes": {
        "detection_method": "resolved_ast",
        "decorator": "langchain_core.tools.tool"
      }
    },
    {
      "id": "TOOL-9972f365ee161300",
      "kind": "asset",
      "subtype": "tool",
      "category": "tooling",
      "label": "run_shell",
      "qualified_name": "app.run_shell",
      "framework": {
        "name": "langchain",
        "version": "==0.3.27"
      },
      "version": {
        "id": "AGV-2E31D150C6897ED6DCA2",
        "value": "1.4.2",
        "scheme": "declared",
        "source": "project_manifest",
        "evidence": {
          "project_version": "1.4.2"
        }
      },
      "package": {
        "name": "langchain",
        "version": "==0.3.27"
      },
      "content_digest": "sha256:ba4f04b7cb036f91135828acaf2192b14ad91837cb5e4cca9ab5d1b6cb061657",
      "source": {
        "file": "app.py",
        "line": 12
      },
      "risk": {
        "finding_count": 0,
        "max_severity": "None"
      },
      "attributes": {
        "detection_method": "resolved_ast",
        "decorator": "langchain_core.tools.tool",
        "capabilities": [
          "process.execute"
        ]
      }
    },
    {
      "id": "MODEL-d83bb665e203f289",
      "kind": "asset",
      "subtype": "model",
      "category": "model_runtime",
      "label": "gpt-4o-2024-11-20",
      "qualified_name": "app.llm",
      "framework": {
        "name": "langchain",
        "version": "==0.3.27"
      },
      "version": {
        "id": "AGV-B03795478936714F60D6",
        "value": "gpt-4o-2024-11-20",
        "scheme": "model-id",
        "source": "model_identifier",
        "evidence": {
          "model_id": "gpt-4o-2024-11-20"
        }
      },
      "package": {
        "name": "langchain",
        "version": "==0.3.27"
      },
      "content_digest": "sha256:81c5f09fae7435f9b860a9a3bf30e3c14280a237a61516a6c154886060ddeb8c",
      "source": {
        "file": "app.py",
        "line": 15
      },
      "risk": {
        "finding_count": 0,
        "max_severity": "None"
      },
      "attributes": {
        "detection_method": "resolved_ast",
        "constructor": "langchain_openai.ChatOpenAI",
        "model": "gpt-4o-2024-11-20"
      }
    },
    {
      "id": "AGENT-402ceaa3621c3c2b",
      "kind": "asset",
      "subtype": "agent",
      "category": "agentic",
      "label": "support-agent",
      "qualified_name": "app.agent",
      "framework": {
        "name": "langgraph",
        "version": "==0.6.4"
      },
      "version": {
        "id": "AGV-0B28632D025A3B8A3582",
        "value": "2.1.0",
        "scheme": "declared",
        "source": "agent_manifest",
        "evidence": {
          "manifest": ".well-known/agent-card.json",
          "declared_version": "2.1.0"
        }
      },
      "package": {
        "name": "langgraph",
        "version": "==0.6.4"
      },
      "content_digest": "sha256:cb69f90325bdba8cb73f8576decbd78e2bbad94976a96692c68d03be8aded5a7",
      "source": {
        "file": "app.py",
        "line": 16
      },
      "risk": {
        "finding_count": 0,
        "max_severity": "None"
      },
      "attributes": {
        "detection_method": "resolved_ast",
        "constructor": "langgraph.prebuilt.create_react_agent",
        "description": "Customer support agent",
        "url": "https://agents.example.test/support",
        "capabilities": {
          "streaming": true
        },
        "skills": [
          {
            "id": "customer_lookup",
            "name": "customer_lookup",
            "version": "1.2.0"
          }
        ]
      }
    },
    {
      "id": "MCP_SERVER-6f5be171a25f8770",
      "kind": "asset",
      "subtype": "mcp_server",
      "category": "mcp",
      "label": "support-mcp",
      "qualified_name": "app.mcp",
      "framework": {
        "name": "mcp",
        "version": "==1.13.1"
      },
      "version": {
        "id": "AGV-BC4985A0C03769ED82E0",
        "value": "3.0.0",
        "scheme": "declared",
        "source": "constructor",
        "evidence": {
          "declared_version": "3.0.0"
        }
      },
      "package": {
        "name": "mcp",
        "version": "==1.13.1"
      },
      "content_digest": "sha256:79c9623d5c3b2ecd3faac589fdb99a0ad8bc8df7419cc7df7612f9a3f0b62521",
      "source": {
        "file": "app.py",
        "line": 17
      },
      "risk": {
        "finding_count": 0,
        "max_severity": "None"
      },
      "attributes": {
        "detection_method": "resolved_ast",
        "constructor": "mcp.server.fastmcp.FastMCP",
        "version": "3.0.0"
      }
    },
    {
      "id": "CAPABILITY-2f3deb384fe85932",
      "kind": "asset",
      "subtype": "capability",
      "category": "capability",
      "label": "process.execute",
      "qualified_name": "capability.process.execute",
      "framework": {
        "name": "",
        "version": ""
      },
      "version": {
        "id": "AGV-EF1B9FDDEC807FEFF80F",
        "value": "rev-890e1c78f236",
        "scheme": "content-digest",
        "source": "content_hash",
        "evidence": {
          "sha256": "890e1c78f2363dfd9e6c693aaba7085e891febb2a844a58de1e1a3cd306f6097"
        }
      },
      "package": {
        "name": "",
        "version": ""
      },
      "content_digest": "sha256:890e1c78f2363dfd9e6c693aaba7085e891febb2a844a58de1e1a3cd306f6097",
      "source": {
        "file": "app.py",
        "line": 13
      },
      "risk": {
        "finding_count": 7,
        "max_severity": "Critical",
        "finding_ids": [
          "AGF-E08A030B34D6F8E95CFA578E",
          "AGF-0F809C2872CFBF027017063B",
          "AGF-6EAE471CB485452E50939DCF",
          "AGF-5B2266F01D69FB1D1756A678",
          "AGF-F59FBBDAF0424258CEAF870A",
          "AGF-D16F4E44456648436C0FA86E",
          "AGF-745EFF8B50F44E56730F20F7"
        ]
      },
      "attributes": {
        "detection_method": "resolved_ast",
        "virtual": true
      }
    },
    {
      "id": "SKILL-1c905af191a08e5e",
      "kind": "asset",
      "subtype": "skill",
      "category": "tooling",
      "label": "customer_lookup",
      "qualified_name": "skill.skills/customer_lookup/SKILL.md",
      "framework": {
        "name": "",
        "version": ""
      },
      "version": {
        "id": "AGV-2A8741CF185DEA3FA560",
        "value": "1.2.0",
        "scheme": "declared",
        "source": "constructor",
        "evidence": {
          "declared_version": "1.2.0"
        }
      },
      "package": {
        "name": "",
        "version": ""
      },
      "content_digest": "sha256:461b158068c5b74b1fe745594441108e961fa3e3f7e9e8e145a48f96c504be87",
      "source": {
        "file": "skills/customer_lookup/SKILL.md",
        "line": 1
      },
      "risk": {
        "finding_count": 1,
        "max_severity": "Low",
        "finding_ids": [
          "AGF-CB7A85CA5A530C9A8FD3981B"
        ]
      },
      "attributes": {
        "detection_method": "resolved_ast",
        "format": ".md"
      }
    },
    {
      "id": "DEPENDENCY-80fbff84acdebdde",
      "kind": "asset",
      "subtype": "dependency",
      "category": "dependency",
      "label": "langgraph",
      "qualified_name": "dependency.langgraph",
      "framework": {
        "name": "",
        "version": ""
      },
      "version": {
        "id": "AGV-9BDD76C2513AC17D5233",
        "value": "==0.6.4",
        "scheme": "declared",
        "source": "constructor",
        "evidence": {
          "declared_version": "==0.6.4"
        }
      },
      "package": {
        "name": "langgraph",
        "version": "==0.6.4"
      },
      "content_digest": "sha256:7a05217c790ca5fae3152917ef21af7dde32a1c84719c6f0af75ea52628084ba",
      "source": {